No.     Time           Source                Destination           MAC src    Protocol Length MAC dst    Info
      1 0.000000000    a2:19:52:a1:10:1a     Broadcast             a2:19:52:a1:10:1a ARP      60     ff:ff:ff:ff:ff:ff Who has 10.10.0.1? Tell 10.10.0.10

Frame 1: 60 bytes on wire (480 bits), 60 bytes captured (480 bits) on interface eth0, id 0
Ethernet II, Src: a2:19:52:a1:10:1a (a2:19:52:a1:10:1a), Dst: Broadcast (ff:ff:ff:ff:ff:ff)
Address Resolution Protocol (request)

No.     Time           Source                Destination           MAC src    Protocol Length MAC dst    Info
      2 0.000199121    2a:89:5b:62:44:f2     a2:19:52:a1:10:1a     2a:89:5b:62:44:f2 ARP      60     a2:19:52:a1:10:1a 10.10.0.1 is at 2a:89:5b:62:44:f2

Frame 2: 60 bytes on wire (480 bits), 60 bytes captured (480 bits) on interface eth0, id 0
Ethernet II, Src: 2a:89:5b:62:44:f2 (2a:89:5b:62:44:f2), Dst: a2:19:52:a1:10:1a (a2:19:52:a1:10:1a)
Address Resolution Protocol (reply)

No.     Time           Source                Destination           MAC src    Protocol Length MAC dst    Info
      3 0.000465697    10.10.0.10            8.8.8.8               a2:19:52:a1:10:1a DNS      81     2a:89:5b:62:44:f2 Standard query 0x76fd A proxy.tpfinal-tyr.com

Frame 3: 81 bytes on wire (648 bits), 81 bytes captured (648 bits) on interface eth0, id 0
Ethernet II, Src: a2:19:52:a1:10:1a (a2:19:52:a1:10:1a), Dst: 2a:89:5b:62:44:f2 (2a:89:5b:62:44:f2)
Internet Protocol Version 4, Src: 10.10.0.10, Dst: 8.8.8.8
User Datagram Protocol, Src Port: 54540, Dst Port: 53
Domain Name System (query)

No.     Time           Source                Destination           MAC src    Protocol Length MAC dst    Info
      4 0.000567196    2a:89:5b:62:44:f2     Broadcast             2a:89:5b:62:44:f2 ARP      60     ff:ff:ff:ff:ff:ff Who has 10.10.0.100? Tell 10.10.0.1

Frame 4: 60 bytes on wire (480 bits), 60 bytes captured (480 bits) on interface eth0, id 0
Ethernet II, Src: 2a:89:5b:62:44:f2 (2a:89:5b:62:44:f2), Dst: Broadcast (ff:ff:ff:ff:ff:ff)
Address Resolution Protocol (request)

No.     Time           Source                Destination           MAC src    Protocol Length MAC dst    Info
      5 0.000655801    b6:0c:f9:58:64:27     2a:89:5b:62:44:f2     b6:0c:f9:58:64:27 ARP      60     2a:89:5b:62:44:f2 10.10.0.100 is at b6:0c:f9:58:64:27

Frame 5: 60 bytes on wire (480 bits), 60 bytes captured (480 bits) on interface eth0, id 0
Ethernet II, Src: b6:0c:f9:58:64:27 (b6:0c:f9:58:64:27), Dst: 2a:89:5b:62:44:f2 (2a:89:5b:62:44:f2)
Address Resolution Protocol (reply)

No.     Time           Source                Destination           MAC src    Protocol Length MAC dst    Info
      6 0.000774532    10.10.0.10            8.8.8.8               2a:89:5b:62:44:f2 DNS      81     b6:0c:f9:58:64:27 Standard query 0x76fd A proxy.tpfinal-tyr.com

Frame 6: 81 bytes on wire (648 bits), 81 bytes captured (648 bits) on interface eth0, id 0
Ethernet II, Src: 2a:89:5b:62:44:f2 (2a:89:5b:62:44:f2), Dst: b6:0c:f9:58:64:27 (b6:0c:f9:58:64:27)
Internet Protocol Version 4, Src: 10.10.0.10, Dst: 8.8.8.8
User Datagram Protocol, Src Port: 54540, Dst Port: 53
Domain Name System (query)

No.     Time           Source                Destination           MAC src    Protocol Length MAC dst    Info
      7 0.002095542    b6:0c:f9:58:64:27     Broadcast             b6:0c:f9:58:64:27 ARP      60     ff:ff:ff:ff:ff:ff Who has 10.10.0.10? Tell 10.10.0.100

Frame 7: 60 bytes on wire (480 bits), 60 bytes captured (480 bits) on interface eth0, id 0
Ethernet II, Src: b6:0c:f9:58:64:27 (b6:0c:f9:58:64:27), Dst: Broadcast (ff:ff:ff:ff:ff:ff)
Address Resolution Protocol (request)

No.     Time           Source                Destination           MAC src    Protocol Length MAC dst    Info
      8 0.002184748    a2:19:52:a1:10:1a     b6:0c:f9:58:64:27     a2:19:52:a1:10:1a ARP      60     b6:0c:f9:58:64:27 10.10.0.10 is at a2:19:52:a1:10:1a

Frame 8: 60 bytes on wire (480 bits), 60 bytes captured (480 bits) on interface eth0, id 0
Ethernet II, Src: a2:19:52:a1:10:1a (a2:19:52:a1:10:1a), Dst: b6:0c:f9:58:64:27 (b6:0c:f9:58:64:27)
Address Resolution Protocol (reply)

No.     Time           Source                Destination           MAC src    Protocol Length MAC dst    Info
      9 0.002284514    8.8.8.8               10.10.0.10            b6:0c:f9:58:64:27 DNS      97     a2:19:52:a1:10:1a Standard query response 0x76fd A proxy.tpfinal-tyr.com A 10.10.0.1

Frame 9: 97 bytes on wire (776 bits), 97 bytes captured (776 bits) on interface eth0, id 0
Ethernet II, Src: b6:0c:f9:58:64:27 (b6:0c:f9:58:64:27), Dst: a2:19:52:a1:10:1a (a2:19:52:a1:10:1a)
Internet Protocol Version 4, Src: 8.8.8.8, Dst: 10.10.0.10
User Datagram Protocol, Src Port: 53, Dst Port: 54540
Domain Name System (response)

No.     Time           Source                Destination           MAC src    Protocol Length MAC dst    Info
     10 0.002549567    10.10.0.10            8.8.8.8               a2:19:52:a1:10:1a DNS      81     2a:89:5b:62:44:f2 Standard query 0xf7fb AAAA proxy.tpfinal-tyr.com

Frame 10: 81 bytes on wire (648 bits), 81 bytes captured (648 bits) on interface eth0, id 0
Ethernet II, Src: a2:19:52:a1:10:1a (a2:19:52:a1:10:1a), Dst: 2a:89:5b:62:44:f2 (2a:89:5b:62:44:f2)
Internet Protocol Version 4, Src: 10.10.0.10, Dst: 8.8.8.8
User Datagram Protocol, Src Port: 54540, Dst Port: 53
Domain Name System (query)

No.     Time           Source                Destination           MAC src    Protocol Length MAC dst    Info
     11 0.002653561    10.10.0.10            8.8.8.8               2a:89:5b:62:44:f2 DNS      81     b6:0c:f9:58:64:27 Standard query 0xf7fb AAAA proxy.tpfinal-tyr.com

Frame 11: 81 bytes on wire (648 bits), 81 bytes captured (648 bits) on interface eth0, id 0
Ethernet II, Src: 2a:89:5b:62:44:f2 (2a:89:5b:62:44:f2), Dst: b6:0c:f9:58:64:27 (b6:0c:f9:58:64:27)
Internet Protocol Version 4, Src: 10.10.0.10, Dst: 8.8.8.8
User Datagram Protocol, Src Port: 54540, Dst Port: 53
Domain Name System (query)

No.     Time           Source                Destination           MAC src    Protocol Length MAC dst    Info
     12 0.003363663    8.8.8.8               10.10.0.10            b6:0c:f9:58:64:27 DNS      126    a2:19:52:a1:10:1a Standard query response 0xf7fb AAAA proxy.tpfinal-tyr.com SOA dns.tpfinal-tyr.com

Frame 12: 126 bytes on wire (1008 bits), 126 bytes captured (1008 bits) on interface eth0, id 0
Ethernet II, Src: b6:0c:f9:58:64:27 (b6:0c:f9:58:64:27), Dst: a2:19:52:a1:10:1a (a2:19:52:a1:10:1a)
Internet Protocol Version 4, Src: 8.8.8.8, Dst: 10.10.0.10
User Datagram Protocol, Src Port: 53, Dst Port: 54540
Domain Name System (response)

No.     Time           Source                Destination           MAC src    Protocol Length MAC dst    Info
     13 0.003705489    10.10.0.10            10.10.0.1             a2:19:52:a1:10:1a TCP      74     2a:89:5b:62:44:f2 43018 → 3128 [SYN] Seq=0 Win=64240 Len=0 MSS=1460 SACK_PERM TSval=3865731839 TSecr=0 WS=128

Frame 13: 74 bytes on wire (592 bits), 74 bytes captured (592 bits) on interface eth0, id 0
Ethernet II, Src: a2:19:52:a1:10:1a (a2:19:52:a1:10:1a), Dst: 2a:89:5b:62:44:f2 (2a:89:5b:62:44:f2)
Internet Protocol Version 4, Src: 10.10.0.10, Dst: 10.10.0.1
Transmission Control Protocol, Src Port: 43018, Dst Port: 3128, Seq: 0, Len: 0

No.     Time           Source                Destination           MAC src    Protocol Length MAC dst    Info
     14 0.003834019    10.10.0.1             10.10.0.10            2a:89:5b:62:44:f2 TCP      74     a2:19:52:a1:10:1a 3128 → 43018 [SYN, ACK] Seq=0 Ack=1 Win=65160 Len=0 MSS=1460 SACK_PERM TSval=3185433764 TSecr=3865731839 WS=128

Frame 14: 74 bytes on wire (592 bits), 74 bytes captured (592 bits) on interface eth0, id 0
Ethernet II, Src: 2a:89:5b:62:44:f2 (2a:89:5b:62:44:f2), Dst: a2:19:52:a1:10:1a (a2:19:52:a1:10:1a)
Internet Protocol Version 4, Src: 10.10.0.1, Dst: 10.10.0.10
Transmission Control Protocol, Src Port: 3128, Dst Port: 43018, Seq: 0, Ack: 1, Len: 0

No.     Time           Source                Destination           MAC src    Protocol Length MAC dst    Info
     15 0.004598272    10.10.0.10            10.10.0.1             a2:19:52:a1:10:1a TCP      66     2a:89:5b:62:44:f2 43018 → 3128 [ACK] Seq=1 Ack=1 Win=64256 Len=0 TSval=3865731839 TSecr=3185433764

Frame 15: 66 bytes on wire (528 bits), 66 bytes captured (528 bits) on interface eth0, id 0
Ethernet II, Src: a2:19:52:a1:10:1a (a2:19:52:a1:10:1a), Dst: 2a:89:5b:62:44:f2 (2a:89:5b:62:44:f2)
Internet Protocol Version 4, Src: 10.10.0.10, Dst: 10.10.0.1
Transmission Control Protocol, Src Port: 43018, Dst Port: 3128, Seq: 1, Ack: 1, Len: 0

No.     Time           Source                Destination           MAC src    Protocol Length MAC dst    Info
     16 0.005011631    10.10.0.10            10.10.0.1             a2:19:52:a1:10:1a HTTP     311    2a:89:5b:62:44:f2 GET http://www.tpfinal-tyr.com/ HTTP/1.0 

Frame 16: 311 bytes on wire (2488 bits), 311 bytes captured (2488 bits) on interface eth0, id 0
Ethernet II, Src: a2:19:52:a1:10:1a (a2:19:52:a1:10:1a), Dst: 2a:89:5b:62:44:f2 (2a:89:5b:62:44:f2)
Internet Protocol Version 4, Src: 10.10.0.10, Dst: 10.10.0.1
Transmission Control Protocol, Src Port: 43018, Dst Port: 3128, Seq: 1, Ack: 1, Len: 245
Hypertext Transfer Protocol

No.     Time           Source                Destination           MAC src    Protocol Length MAC dst    Info
     17 0.005279941    10.10.0.1             8.8.8.8               2a:89:5b:62:44:f2 DNS      83     b6:0c:f9:58:64:27 Standard query 0xe717 PTR 10.0.10.10.in-addr.arpa

Frame 17: 83 bytes on wire (664 bits), 83 bytes captured (664 bits) on interface eth0, id 0
Ethernet II, Src: 2a:89:5b:62:44:f2 (2a:89:5b:62:44:f2), Dst: b6:0c:f9:58:64:27 (b6:0c:f9:58:64:27)
Internet Protocol Version 4, Src: 10.10.0.1, Dst: 8.8.8.8
User Datagram Protocol, Src Port: 41929, Dst Port: 53
Domain Name System (query)

No.     Time           Source                Destination           MAC src    Protocol Length MAC dst    Info
     18 0.005369287    10.10.0.1             10.10.0.10            2a:89:5b:62:44:f2 TCP      66     a2:19:52:a1:10:1a 3128 → 43018 [ACK] Seq=1 Ack=246 Win=65024 Len=0 TSval=3185433765 TSecr=3865731840

Frame 18: 66 bytes on wire (528 bits), 66 bytes captured (528 bits) on interface eth0, id 0
Ethernet II, Src: 2a:89:5b:62:44:f2 (2a:89:5b:62:44:f2), Dst: a2:19:52:a1:10:1a (a2:19:52:a1:10:1a)
Internet Protocol Version 4, Src: 10.10.0.1, Dst: 10.10.0.10
Transmission Control Protocol, Src Port: 3128, Dst Port: 43018, Seq: 1, Ack: 246, Len: 0

No.     Time           Source                Destination           MAC src    Protocol Length MAC dst    Info
     19 0.005568678    10.10.0.1             8.8.8.8               2a:89:5b:62:44:f2 DNS      79     b6:0c:f9:58:64:27 Standard query 0xa7e2 A www.tpfinal-tyr.com

Frame 19: 79 bytes on wire (632 bits), 79 bytes captured (632 bits) on interface eth0, id 0
Ethernet II, Src: 2a:89:5b:62:44:f2 (2a:89:5b:62:44:f2), Dst: b6:0c:f9:58:64:27 (b6:0c:f9:58:64:27)
Internet Protocol Version 4, Src: 10.10.0.1, Dst: 8.8.8.8
User Datagram Protocol, Src Port: 41929, Dst Port: 53
Domain Name System (query)

No.     Time           Source                Destination           MAC src    Protocol Length MAC dst    Info
     20 0.006220883    8.8.8.8               10.10.0.1             b6:0c:f9:58:64:27 DNS      133    2a:89:5b:62:44:f2 Standard query response 0xe717 No such name PTR 10.0.10.10.in-addr.arpa SOA 10.IN-ADDR.ARPA

Frame 20: 133 bytes on wire (1064 bits), 133 bytes captured (1064 bits) on interface eth0, id 0
Ethernet II, Src: b6:0c:f9:58:64:27 (b6:0c:f9:58:64:27), Dst: 2a:89:5b:62:44:f2 (2a:89:5b:62:44:f2)
Internet Protocol Version 4, Src: 8.8.8.8, Dst: 10.10.0.1
User Datagram Protocol, Src Port: 53, Dst Port: 41929
Domain Name System (response)

No.     Time           Source                Destination           MAC src    Protocol Length MAC dst    Info
     21 0.006702990    8.8.8.8               10.10.0.1             b6:0c:f9:58:64:27 DNS      95     2a:89:5b:62:44:f2 Standard query response 0xa7e2 A www.tpfinal-tyr.com A 12.12.0.11

Frame 21: 95 bytes on wire (760 bits), 95 bytes captured (760 bits) on interface eth0, id 0
Ethernet II, Src: b6:0c:f9:58:64:27 (b6:0c:f9:58:64:27), Dst: 2a:89:5b:62:44:f2 (2a:89:5b:62:44:f2)
Internet Protocol Version 4, Src: 8.8.8.8, Dst: 10.10.0.1
User Datagram Protocol, Src Port: 53, Dst Port: 41929
Domain Name System (response)

No.     Time           Source                Destination           MAC src    Protocol Length MAC dst    Info
     22 0.007111411    10.10.0.1             12.12.0.11            2a:89:5b:62:44:f2 TCP      74     b6:0c:f9:58:64:27 47548 → 80 [SYN] Seq=0 Win=64240 Len=0 MSS=1460 SACK_PERM TSval=1575292112 TSecr=0 WS=128

Frame 22: 74 bytes on wire (592 bits), 74 bytes captured (592 bits) on interface eth0, id 0
Ethernet II, Src: 2a:89:5b:62:44:f2 (2a:89:5b:62:44:f2), Dst: b6:0c:f9:58:64:27 (b6:0c:f9:58:64:27)
Internet Protocol Version 4, Src: 10.10.0.1, Dst: 12.12.0.11
Transmission Control Protocol, Src Port: 47548, Dst Port: 80, Seq: 0, Len: 0

No.     Time           Source                Destination           MAC src    Protocol Length MAC dst    Info
     23 0.008307648    12.12.0.11            10.10.0.1             b6:0c:f9:58:64:27 TCP      74     2a:89:5b:62:44:f2 80 → 47548 [SYN, ACK] Seq=0 Ack=1 Win=65160 Len=0 MSS=1460 SACK_PERM TSval=1709114237 TSecr=1575292112 WS=128

Frame 23: 74 bytes on wire (592 bits), 74 bytes captured (592 bits) on interface eth0, id 0
Ethernet II, Src: b6:0c:f9:58:64:27 (b6:0c:f9:58:64:27), Dst: 2a:89:5b:62:44:f2 (2a:89:5b:62:44:f2)
Internet Protocol Version 4, Src: 12.12.0.11, Dst: 10.10.0.1
Transmission Control Protocol, Src Port: 80, Dst Port: 47548, Seq: 0, Ack: 1, Len: 0

No.     Time           Source                Destination           MAC src    Protocol Length MAC dst    Info
     24 0.008478596    10.10.0.1             12.12.0.11            2a:89:5b:62:44:f2 TCP      66     b6:0c:f9:58:64:27 47548 → 80 [ACK] Seq=1 Ack=1 Win=64256 Len=0 TSval=1575292113 TSecr=1709114237

Frame 24: 66 bytes on wire (528 bits), 66 bytes captured (528 bits) on interface eth0, id 0
Ethernet II, Src: 2a:89:5b:62:44:f2 (2a:89:5b:62:44:f2), Dst: b6:0c:f9:58:64:27 (b6:0c:f9:58:64:27)
Internet Protocol Version 4, Src: 10.10.0.1, Dst: 12.12.0.11
Transmission Control Protocol, Src Port: 47548, Dst Port: 80, Seq: 1, Ack: 1, Len: 0

No.     Time           Source                Destination           MAC src    Protocol Length MAC dst    Info
     25 0.008798081    10.10.0.1             12.12.0.11            2a:89:5b:62:44:f2 ICMP     78     b6:0c:f9:58:64:27 Echo (ping) request  id=0x4c00, seq=256/1, ttl=64 (reply in 27)

Frame 25: 78 bytes on wire (624 bits), 78 bytes captured (624 bits) on interface eth0, id 0
Ethernet II, Src: 2a:89:5b:62:44:f2 (2a:89:5b:62:44:f2), Dst: b6:0c:f9:58:64:27 (b6:0c:f9:58:64:27)
Internet Protocol Version 4, Src: 10.10.0.1, Dst: 12.12.0.11
Internet Control Message Protocol

No.     Time           Source                Destination           MAC src    Protocol Length MAC dst    Info
     26 0.009350820    10.10.0.1             12.12.0.11            2a:89:5b:62:44:f2 HTTP     413    b6:0c:f9:58:64:27 GET / HTTP/1.1 

Frame 26: 413 bytes on wire (3304 bits), 413 bytes captured (3304 bits) on interface eth0, id 0
Ethernet II, Src: 2a:89:5b:62:44:f2 (2a:89:5b:62:44:f2), Dst: b6:0c:f9:58:64:27 (b6:0c:f9:58:64:27)
Internet Protocol Version 4, Src: 10.10.0.1, Dst: 12.12.0.11
Transmission Control Protocol, Src Port: 47548, Dst Port: 80, Seq: 1, Ack: 1, Len: 347
Hypertext Transfer Protocol

No.     Time           Source                Destination           MAC src    Protocol Length MAC dst    Info
     27 0.009566823    12.12.0.11            10.10.0.1             b6:0c:f9:58:64:27 ICMP     78     2a:89:5b:62:44:f2 Echo (ping) reply    id=0x4c00, seq=256/1, ttl=62 (request in 25)

Frame 27: 78 bytes on wire (624 bits), 78 bytes captured (624 bits) on interface eth0, id 0
Ethernet II, Src: b6:0c:f9:58:64:27 (b6:0c:f9:58:64:27), Dst: 2a:89:5b:62:44:f2 (2a:89:5b:62:44:f2)
Internet Protocol Version 4, Src: 12.12.0.11, Dst: 10.10.0.1
Internet Control Message Protocol

No.     Time           Source                Destination           MAC src    Protocol Length MAC dst    Info
     28 0.011087644    12.12.0.11            10.10.0.1             b6:0c:f9:58:64:27 TCP      66     2a:89:5b:62:44:f2 80 → 47548 [ACK] Seq=1 Ack=348 Win=64896 Len=0 TSval=1709114239 TSecr=1575292114

Frame 28: 66 bytes on wire (528 bits), 66 bytes captured (528 bits) on interface eth0, id 0
Ethernet II, Src: b6:0c:f9:58:64:27 (b6:0c:f9:58:64:27), Dst: 2a:89:5b:62:44:f2 (2a:89:5b:62:44:f2)
Internet Protocol Version 4, Src: 12.12.0.11, Dst: 10.10.0.1
Transmission Control Protocol, Src Port: 80, Dst Port: 47548, Seq: 1, Ack: 348, Len: 0

No.     Time           Source                Destination           MAC src    Protocol Length MAC dst    Info
     29 0.011784161    12.12.0.11            10.10.0.1             b6:0c:f9:58:64:27 HTTP     559    2a:89:5b:62:44:f2 HTTP/1.1 200 OK  (text/html)

Frame 29: 559 bytes on wire (4472 bits), 559 bytes captured (4472 bits) on interface eth0, id 0
Ethernet II, Src: b6:0c:f9:58:64:27 (b6:0c:f9:58:64:27), Dst: 2a:89:5b:62:44:f2 (2a:89:5b:62:44:f2)
Internet Protocol Version 4, Src: 12.12.0.11, Dst: 10.10.0.1
Transmission Control Protocol, Src Port: 80, Dst Port: 47548, Seq: 1, Ack: 348, Len: 493
Hypertext Transfer Protocol
Line-based text data: text/html (10 lines)

No.     Time           Source                Destination           MAC src    Protocol Length MAC dst    Info
     30 0.011974315    10.10.0.1             12.12.0.11            2a:89:5b:62:44:f2 TCP      66     b6:0c:f9:58:64:27 47548 → 80 [ACK] Seq=348 Ack=494 Win=64128 Len=0 TSval=1575292117 TSecr=1709114240

Frame 30: 66 bytes on wire (528 bits), 66 bytes captured (528 bits) on interface eth0, id 0
Ethernet II, Src: 2a:89:5b:62:44:f2 (2a:89:5b:62:44:f2), Dst: b6:0c:f9:58:64:27 (b6:0c:f9:58:64:27)
Internet Protocol Version 4, Src: 10.10.0.1, Dst: 12.12.0.11
Transmission Control Protocol, Src Port: 47548, Dst Port: 80, Seq: 348, Ack: 494, Len: 0

No.     Time           Source                Destination           MAC src    Protocol Length MAC dst    Info
     31 0.012146255    12.12.0.11            10.10.0.1             b6:0c:f9:58:64:27 TCP      66     2a:89:5b:62:44:f2 80 → 47548 [FIN, ACK] Seq=494 Ack=348 Win=64896 Len=0 TSval=1709114240 TSecr=1575292114

Frame 31: 66 bytes on wire (528 bits), 66 bytes captured (528 bits) on interface eth0, id 0
Ethernet II, Src: b6:0c:f9:58:64:27 (b6:0c:f9:58:64:27), Dst: 2a:89:5b:62:44:f2 (2a:89:5b:62:44:f2)
Internet Protocol Version 4, Src: 12.12.0.11, Dst: 10.10.0.1
Transmission Control Protocol, Src Port: 80, Dst Port: 47548, Seq: 494, Ack: 348, Len: 0

No.     Time           Source                Destination           MAC src    Protocol Length MAC dst    Info
     32 0.012435273    10.10.0.1             12.12.0.11            2a:89:5b:62:44:f2 TCP      66     b6:0c:f9:58:64:27 47548 → 80 [FIN, ACK] Seq=348 Ack=494 Win=64128 Len=0 TSval=1575292117 TSecr=1709114240

Frame 32: 66 bytes on wire (528 bits), 66 bytes captured (528 bits) on interface eth0, id 0
Ethernet II, Src: 2a:89:5b:62:44:f2 (2a:89:5b:62:44:f2), Dst: b6:0c:f9:58:64:27 (b6:0c:f9:58:64:27)
Internet Protocol Version 4, Src: 10.10.0.1, Dst: 12.12.0.11
Transmission Control Protocol, Src Port: 47548, Dst Port: 80, Seq: 348, Ack: 494, Len: 0

No.     Time           Source                Destination           MAC src    Protocol Length MAC dst    Info
     33 0.020250404    10.10.0.1             10.10.0.10            2a:89:5b:62:44:f2 TCP      506    a2:19:52:a1:10:1a 3128 → 43018 [PSH, ACK] Seq=1 Ack=246 Win=65024 Len=440 TSval=3185433772 TSecr=3865731840 [TCP segment of a reassembled PDU]

Frame 33: 506 bytes on wire (4048 bits), 506 bytes captured (4048 bits) on interface eth0, id 0
Ethernet II, Src: 2a:89:5b:62:44:f2 (2a:89:5b:62:44:f2), Dst: a2:19:52:a1:10:1a (a2:19:52:a1:10:1a)
Internet Protocol Version 4, Src: 10.10.0.1, Dst: 10.10.0.10
Transmission Control Protocol, Src Port: 3128, Dst Port: 43018, Seq: 1, Ack: 246, Len: 440

No.     Time           Source                Destination           MAC src    Protocol Length MAC dst    Info
     34 0.020489129    10.10.0.10            10.10.0.1             a2:19:52:a1:10:1a TCP      66     2a:89:5b:62:44:f2 43018 → 3128 [ACK] Seq=246 Ack=441 Win=64128 Len=0 TSval=3865731848 TSecr=3185433772

Frame 34: 66 bytes on wire (528 bits), 66 bytes captured (528 bits) on interface eth0, id 0
Ethernet II, Src: a2:19:52:a1:10:1a (a2:19:52:a1:10:1a), Dst: 2a:89:5b:62:44:f2 (2a:89:5b:62:44:f2)
Internet Protocol Version 4, Src: 10.10.0.10, Dst: 10.10.0.1
Transmission Control Protocol, Src Port: 43018, Dst Port: 3128, Seq: 246, Ack: 441, Len: 0

No.     Time           Source                Destination           MAC src    Protocol Length MAC dst    Info
     35 0.020660728    12.12.0.11            10.10.0.1             b6:0c:f9:58:64:27 TCP      66     2a:89:5b:62:44:f2 80 → 47548 [ACK] Seq=495 Ack=349 Win=64896 Len=0 TSval=1709114249 TSecr=1575292117

Frame 35: 66 bytes on wire (528 bits), 66 bytes captured (528 bits) on interface eth0, id 0
Ethernet II, Src: b6:0c:f9:58:64:27 (b6:0c:f9:58:64:27), Dst: 2a:89:5b:62:44:f2 (2a:89:5b:62:44:f2)
Internet Protocol Version 4, Src: 12.12.0.11, Dst: 10.10.0.1
Transmission Control Protocol, Src Port: 80, Dst Port: 47548, Seq: 495, Ack: 349, Len: 0

No.     Time           Source                Destination           MAC src    Protocol Length MAC dst    Info
     36 0.020768409    10.10.0.1             10.10.0.10            2a:89:5b:62:44:f2 HTTP     259    a2:19:52:a1:10:1a HTTP/1.1 200 OK  (text/html)

Frame 36: 259 bytes on wire (2072 bits), 259 bytes captured (2072 bits) on interface eth0, id 0
Ethernet II, Src: 2a:89:5b:62:44:f2 (2a:89:5b:62:44:f2), Dst: a2:19:52:a1:10:1a (a2:19:52:a1:10:1a)
Internet Protocol Version 4, Src: 10.10.0.1, Dst: 10.10.0.10
Transmission Control Protocol, Src Port: 3128, Dst Port: 43018, Seq: 441, Ack: 246, Len: 193
[2 Reassembled TCP Segments (633 bytes): #33(440), #36(193)]
Hypertext Transfer Protocol
Line-based text data: text/html (10 lines)

No.     Time           Source                Destination           MAC src    Protocol Length MAC dst    Info
     37 0.020863797    10.10.0.10            10.10.0.1             a2:19:52:a1:10:1a TCP      66     2a:89:5b:62:44:f2 43018 → 3128 [ACK] Seq=246 Ack=634 Win=64128 Len=0 TSval=3865731856 TSecr=3185433772

Frame 37: 66 bytes on wire (528 bits), 66 bytes captured (528 bits) on interface eth0, id 0
Ethernet II, Src: a2:19:52:a1:10:1a (a2:19:52:a1:10:1a), Dst: 2a:89:5b:62:44:f2 (2a:89:5b:62:44:f2)
Internet Protocol Version 4, Src: 10.10.0.10, Dst: 10.10.0.1
Transmission Control Protocol, Src Port: 43018, Dst Port: 3128, Seq: 246, Ack: 634, Len: 0

No.     Time           Source                Destination           MAC src    Protocol Length MAC dst    Info
     38 0.020956649    10.10.0.1             10.10.0.10            2a:89:5b:62:44:f2 TCP      66     a2:19:52:a1:10:1a 3128 → 43018 [FIN, ACK] Seq=634 Ack=246 Win=65024 Len=0 TSval=3185433772 TSecr=3865731840

Frame 38: 66 bytes on wire (528 bits), 66 bytes captured (528 bits) on interface eth0, id 0
Ethernet II, Src: 2a:89:5b:62:44:f2 (2a:89:5b:62:44:f2), Dst: a2:19:52:a1:10:1a (a2:19:52:a1:10:1a)
Internet Protocol Version 4, Src: 10.10.0.1, Dst: 10.10.0.10
Transmission Control Protocol, Src Port: 3128, Dst Port: 43018, Seq: 634, Ack: 246, Len: 0

No.     Time           Source                Destination           MAC src    Protocol Length MAC dst    Info
     39 0.021309005    10.10.0.1             12.12.0.11            2a:89:5b:62:44:f2 TCP      66     b6:0c:f9:58:64:27 47548 → 80 [ACK] Seq=349 Ack=495 Win=64128 Len=0 TSval=1575292118 TSecr=1709114240

Frame 39: 66 bytes on wire (528 bits), 66 bytes captured (528 bits) on interface eth0, id 0
Ethernet II, Src: 2a:89:5b:62:44:f2 (2a:89:5b:62:44:f2), Dst: b6:0c:f9:58:64:27 (b6:0c:f9:58:64:27)
Internet Protocol Version 4, Src: 10.10.0.1, Dst: 12.12.0.11
Transmission Control Protocol, Src Port: 47548, Dst Port: 80, Seq: 349, Ack: 495, Len: 0

No.     Time           Source                Destination           MAC src    Protocol Length MAC dst    Info
     40 0.021427917    10.10.0.1             10.10.0.10            2a:89:5b:62:44:f2 TCP      66     a2:19:52:a1:10:1a [TCP Retransmission] 3128 → 43018 [FIN, ACK] Seq=634 Ack=246 Win=65024 Len=0 TSval=3185433777 TSecr=3865731840

Frame 40: 66 bytes on wire (528 bits), 66 bytes captured (528 bits) on interface eth0, id 0
Ethernet II, Src: 2a:89:5b:62:44:f2 (2a:89:5b:62:44:f2), Dst: a2:19:52:a1:10:1a (a2:19:52:a1:10:1a)
Internet Protocol Version 4, Src: 10.10.0.1, Dst: 10.10.0.10
Transmission Control Protocol, Src Port: 3128, Dst Port: 43018, Seq: 634, Ack: 246, Len: 0

No.     Time           Source                Destination           MAC src    Protocol Length MAC dst    Info
     41 0.021555024    10.10.0.10            10.10.0.1             a2:19:52:a1:10:1a TCP      78     2a:89:5b:62:44:f2 43018 → 3128 [ACK] Seq=246 Ack=635 Win=64128 Len=0 TSval=3865731857 TSecr=3185433777 SLE=634 SRE=635

Frame 41: 78 bytes on wire (624 bits), 78 bytes captured (624 bits) on interface eth0, id 0
Ethernet II, Src: a2:19:52:a1:10:1a (a2:19:52:a1:10:1a), Dst: 2a:89:5b:62:44:f2 (2a:89:5b:62:44:f2)
Internet Protocol Version 4, Src: 10.10.0.10, Dst: 10.10.0.1
Transmission Control Protocol, Src Port: 43018, Dst Port: 3128, Seq: 246, Ack: 635, Len: 0

No.     Time           Source                Destination           MAC src    Protocol Length MAC dst    Info
     42 0.024537176    10.10.0.10            10.10.0.1             a2:19:52:a1:10:1a TCP      66     2a:89:5b:62:44:f2 43018 → 3128 [FIN, ACK] Seq=246 Ack=635 Win=64128 Len=0 TSval=3865731860 TSecr=3185433777

Frame 42: 66 bytes on wire (528 bits), 66 bytes captured (528 bits) on interface eth0, id 0
Ethernet II, Src: a2:19:52:a1:10:1a (a2:19:52:a1:10:1a), Dst: 2a:89:5b:62:44:f2 (2a:89:5b:62:44:f2)
Internet Protocol Version 4, Src: 10.10.0.10, Dst: 10.10.0.1
Transmission Control Protocol, Src Port: 43018, Dst Port: 3128, Seq: 246, Ack: 635, Len: 0

No.     Time           Source                Destination           MAC src    Protocol Length MAC dst    Info
     43 0.024632954    10.10.0.1             10.10.0.10            2a:89:5b:62:44:f2 TCP      66     a2:19:52:a1:10:1a 3128 → 43018 [ACK] Seq=635 Ack=247 Win=65024 Len=0 TSval=3185433785 TSecr=3865731860

Frame 43: 66 bytes on wire (528 bits), 66 bytes captured (528 bits) on interface eth0, id 0
Ethernet II, Src: 2a:89:5b:62:44:f2 (2a:89:5b:62:44:f2), Dst: a2:19:52:a1:10:1a (a2:19:52:a1:10:1a)
Internet Protocol Version 4, Src: 10.10.0.1, Dst: 10.10.0.10
Transmission Control Protocol, Src Port: 3128, Dst Port: 43018, Seq: 635, Ack: 247, Len: 0

No.     Time           Source                Destination           MAC src    Protocol Length MAC dst    Info
     44 0.028716798    10.10.0.10            8.8.8.8               a2:19:52:a1:10:1a DNS      81     2a:89:5b:62:44:f2 Standard query 0xbc75 A proxy.tpfinal-tyr.com

Frame 44: 81 bytes on wire (648 bits), 81 bytes captured (648 bits) on interface eth0, id 0
Ethernet II, Src: a2:19:52:a1:10:1a (a2:19:52:a1:10:1a), Dst: 2a:89:5b:62:44:f2 (2a:89:5b:62:44:f2)
Internet Protocol Version 4, Src: 10.10.0.10, Dst: 8.8.8.8
User Datagram Protocol, Src Port: 34664, Dst Port: 53
Domain Name System (query)

No.     Time           Source                Destination           MAC src    Protocol Length MAC dst    Info
     45 0.029039108    10.10.0.10            8.8.8.8               2a:89:5b:62:44:f2 DNS      81     b6:0c:f9:58:64:27 Standard query 0xbc75 A proxy.tpfinal-tyr.com

Frame 45: 81 bytes on wire (648 bits), 81 bytes captured (648 bits) on interface eth0, id 0
Ethernet II, Src: 2a:89:5b:62:44:f2 (2a:89:5b:62:44:f2), Dst: b6:0c:f9:58:64:27 (b6:0c:f9:58:64:27)
Internet Protocol Version 4, Src: 10.10.0.10, Dst: 8.8.8.8
User Datagram Protocol, Src Port: 34664, Dst Port: 53
Domain Name System (query)

No.     Time           Source                Destination           MAC src    Protocol Length MAC dst    Info
     46 0.029458459    8.8.8.8               10.10.0.10            b6:0c:f9:58:64:27 DNS      97     a2:19:52:a1:10:1a Standard query response 0xbc75 A proxy.tpfinal-tyr.com A 10.10.0.1

Frame 46: 97 bytes on wire (776 bits), 97 bytes captured (776 bits) on interface eth0, id 0
Ethernet II, Src: b6:0c:f9:58:64:27 (b6:0c:f9:58:64:27), Dst: a2:19:52:a1:10:1a (a2:19:52:a1:10:1a)
Internet Protocol Version 4, Src: 8.8.8.8, Dst: 10.10.0.10
User Datagram Protocol, Src Port: 53, Dst Port: 34664
Domain Name System (response)

No.     Time           Source                Destination           MAC src    Protocol Length MAC dst    Info
     47 0.029566891    10.10.0.10            8.8.8.8               a2:19:52:a1:10:1a DNS      81     2a:89:5b:62:44:f2 Standard query 0x5476 AAAA proxy.tpfinal-tyr.com

Frame 47: 81 bytes on wire (648 bits), 81 bytes captured (648 bits) on interface eth0, id 0
Ethernet II, Src: a2:19:52:a1:10:1a (a2:19:52:a1:10:1a), Dst: 2a:89:5b:62:44:f2 (2a:89:5b:62:44:f2)
Internet Protocol Version 4, Src: 10.10.0.10, Dst: 8.8.8.8
User Datagram Protocol, Src Port: 34664, Dst Port: 53
Domain Name System (query)

No.     Time           Source                Destination           MAC src    Protocol Length MAC dst    Info
     48 0.030116434    10.10.0.10            8.8.8.8               2a:89:5b:62:44:f2 DNS      81     b6:0c:f9:58:64:27 Standard query 0x5476 AAAA proxy.tpfinal-tyr.com

Frame 48: 81 bytes on wire (648 bits), 81 bytes captured (648 bits) on interface eth0, id 0
Ethernet II, Src: 2a:89:5b:62:44:f2 (2a:89:5b:62:44:f2), Dst: b6:0c:f9:58:64:27 (b6:0c:f9:58:64:27)
Internet Protocol Version 4, Src: 10.10.0.10, Dst: 8.8.8.8
User Datagram Protocol, Src Port: 34664, Dst Port: 53
Domain Name System (query)

No.     Time           Source                Destination           MAC src    Protocol Length MAC dst    Info
     49 0.030229224    8.8.8.8               10.10.0.10            b6:0c:f9:58:64:27 DNS      126    a2:19:52:a1:10:1a Standard query response 0x5476 AAAA proxy.tpfinal-tyr.com SOA dns.tpfinal-tyr.com

Frame 49: 126 bytes on wire (1008 bits), 126 bytes captured (1008 bits) on interface eth0, id 0
Ethernet II, Src: b6:0c:f9:58:64:27 (b6:0c:f9:58:64:27), Dst: a2:19:52:a1:10:1a (a2:19:52:a1:10:1a)
Internet Protocol Version 4, Src: 8.8.8.8, Dst: 10.10.0.10
User Datagram Protocol, Src Port: 53, Dst Port: 34664
Domain Name System (response)

No.     Time           Source                Destination           MAC src    Protocol Length MAC dst    Info
     50 0.030413658    10.10.0.10            10.10.0.1             a2:19:52:a1:10:1a TCP      74     2a:89:5b:62:44:f2 43024 → 3128 [SYN] Seq=0 Win=64240 Len=0 MSS=1460 SACK_PERM TSval=3865731866 TSecr=0 WS=128

Frame 50: 74 bytes on wire (592 bits), 74 bytes captured (592 bits) on interface eth0, id 0
Ethernet II, Src: a2:19:52:a1:10:1a (a2:19:52:a1:10:1a), Dst: 2a:89:5b:62:44:f2 (2a:89:5b:62:44:f2)
Internet Protocol Version 4, Src: 10.10.0.10, Dst: 10.10.0.1
Transmission Control Protocol, Src Port: 43024, Dst Port: 3128, Seq: 0, Len: 0

No.     Time           Source                Destination           MAC src    Protocol Length MAC dst    Info
     51 0.030523913    10.10.0.1             10.10.0.10            2a:89:5b:62:44:f2 TCP      74     a2:19:52:a1:10:1a 3128 → 43024 [SYN, ACK] Seq=0 Ack=1 Win=65160 Len=0 MSS=1460 SACK_PERM TSval=3185433791 TSecr=3865731866 WS=128

Frame 51: 74 bytes on wire (592 bits), 74 bytes captured (592 bits) on interface eth0, id 0
Ethernet II, Src: 2a:89:5b:62:44:f2 (2a:89:5b:62:44:f2), Dst: a2:19:52:a1:10:1a (a2:19:52:a1:10:1a)
Internet Protocol Version 4, Src: 10.10.0.1, Dst: 10.10.0.10
Transmission Control Protocol, Src Port: 3128, Dst Port: 43024, Seq: 0, Ack: 1, Len: 0

No.     Time           Source                Destination           MAC src    Protocol Length MAC dst    Info
     52 0.030751426    10.10.0.10            10.10.0.1             a2:19:52:a1:10:1a TCP      66     2a:89:5b:62:44:f2 43024 → 3128 [ACK] Seq=1 Ack=1 Win=64256 Len=0 TSval=3865731866 TSecr=3185433791

Frame 52: 66 bytes on wire (528 bits), 66 bytes captured (528 bits) on interface eth0, id 0
Ethernet II, Src: a2:19:52:a1:10:1a (a2:19:52:a1:10:1a), Dst: 2a:89:5b:62:44:f2 (2a:89:5b:62:44:f2)
Internet Protocol Version 4, Src: 10.10.0.10, Dst: 10.10.0.1
Transmission Control Protocol, Src Port: 43024, Dst Port: 3128, Seq: 1, Ack: 1, Len: 0

No.     Time           Source                Destination           MAC src    Protocol Length MAC dst    Info
     53 0.031101328    10.10.0.10            10.10.0.1             a2:19:52:a1:10:1a HTTP     363    2a:89:5b:62:44:f2 GET http://datos.tpfinal-tyr.com/index.html HTTP/1.0 

Frame 53: 363 bytes on wire (2904 bits), 363 bytes captured (2904 bits) on interface eth0, id 0
Ethernet II, Src: a2:19:52:a1:10:1a (a2:19:52:a1:10:1a), Dst: 2a:89:5b:62:44:f2 (2a:89:5b:62:44:f2)
Internet Protocol Version 4, Src: 10.10.0.10, Dst: 10.10.0.1
Transmission Control Protocol, Src Port: 43024, Dst Port: 3128, Seq: 1, Ack: 1, Len: 297
Hypertext Transfer Protocol

No.     Time           Source                Destination           MAC src    Protocol Length MAC dst    Info
     54 0.031249524    10.10.0.1             10.10.0.10            2a:89:5b:62:44:f2 TCP      66     a2:19:52:a1:10:1a 3128 → 43024 [ACK] Seq=1 Ack=298 Win=64896 Len=0 TSval=3185433791 TSecr=3865731866

Frame 54: 66 bytes on wire (528 bits), 66 bytes captured (528 bits) on interface eth0, id 0
Ethernet II, Src: 2a:89:5b:62:44:f2 (2a:89:5b:62:44:f2), Dst: a2:19:52:a1:10:1a (a2:19:52:a1:10:1a)
Internet Protocol Version 4, Src: 10.10.0.1, Dst: 10.10.0.10
Transmission Control Protocol, Src Port: 3128, Dst Port: 43024, Seq: 1, Ack: 298, Len: 0

No.     Time           Source                Destination           MAC src    Protocol Length MAC dst    Info
     55 0.031843800    10.10.0.1             8.8.8.8               2a:89:5b:62:44:f2 DNS      81     b6:0c:f9:58:64:27 Standard query 0x44e0 A datos.tpfinal-tyr.com

Frame 55: 81 bytes on wire (648 bits), 81 bytes captured (648 bits) on interface eth0, id 0
Ethernet II, Src: 2a:89:5b:62:44:f2 (2a:89:5b:62:44:f2), Dst: b6:0c:f9:58:64:27 (b6:0c:f9:58:64:27)
Internet Protocol Version 4, Src: 10.10.0.1, Dst: 8.8.8.8
User Datagram Protocol, Src Port: 41929, Dst Port: 53
Domain Name System (query)

No.     Time           Source                Destination           MAC src    Protocol Length MAC dst    Info
     56 0.032169847    8.8.8.8               10.10.0.1             b6:0c:f9:58:64:27 DNS      97     2a:89:5b:62:44:f2 Standard query response 0x44e0 A datos.tpfinal-tyr.com A 12.12.0.12

Frame 56: 97 bytes on wire (776 bits), 97 bytes captured (776 bits) on interface eth0, id 0
Ethernet II, Src: b6:0c:f9:58:64:27 (b6:0c:f9:58:64:27), Dst: 2a:89:5b:62:44:f2 (2a:89:5b:62:44:f2)
Internet Protocol Version 4, Src: 8.8.8.8, Dst: 10.10.0.1
User Datagram Protocol, Src Port: 53, Dst Port: 41929
Domain Name System (response)

No.     Time           Source                Destination           MAC src    Protocol Length MAC dst    Info
     57 0.033072769    10.10.0.1             12.12.0.12            2a:89:5b:62:44:f2 TCP      74     b6:0c:f9:58:64:27 60712 → 80 [SYN] Seq=0 Win=64240 Len=0 MSS=1460 SACK_PERM TSval=2356592128 TSecr=0 WS=128

Frame 57: 74 bytes on wire (592 bits), 74 bytes captured (592 bits) on interface eth0, id 0
Ethernet II, Src: 2a:89:5b:62:44:f2 (2a:89:5b:62:44:f2), Dst: b6:0c:f9:58:64:27 (b6:0c:f9:58:64:27)
Internet Protocol Version 4, Src: 10.10.0.1, Dst: 12.12.0.12
Transmission Control Protocol, Src Port: 60712, Dst Port: 80, Seq: 0, Len: 0

No.     Time           Source                Destination           MAC src    Protocol Length MAC dst    Info
     58 0.033712610    12.12.0.12            10.10.0.1             b6:0c:f9:58:64:27 TCP      74     2a:89:5b:62:44:f2 80 → 60712 [SYN, ACK] Seq=0 Ack=1 Win=65160 Len=0 MSS=1460 SACK_PERM TSval=3927818970 TSecr=2356592128 WS=128

Frame 58: 74 bytes on wire (592 bits), 74 bytes captured (592 bits) on interface eth0, id 0
Ethernet II, Src: b6:0c:f9:58:64:27 (b6:0c:f9:58:64:27), Dst: 2a:89:5b:62:44:f2 (2a:89:5b:62:44:f2)
Internet Protocol Version 4, Src: 12.12.0.12, Dst: 10.10.0.1
Transmission Control Protocol, Src Port: 80, Dst Port: 60712, Seq: 0, Ack: 1, Len: 0

No.     Time           Source                Destination           MAC src    Protocol Length MAC dst    Info
     59 0.033999694    10.10.0.1             12.12.0.12            2a:89:5b:62:44:f2 TCP      66     b6:0c:f9:58:64:27 60712 → 80 [ACK] Seq=1 Ack=1 Win=64256 Len=0 TSval=2356592129 TSecr=3927818970

Frame 59: 66 bytes on wire (528 bits), 66 bytes captured (528 bits) on interface eth0, id 0
Ethernet II, Src: 2a:89:5b:62:44:f2 (2a:89:5b:62:44:f2), Dst: b6:0c:f9:58:64:27 (b6:0c:f9:58:64:27)
Internet Protocol Version 4, Src: 10.10.0.1, Dst: 12.12.0.12
Transmission Control Protocol, Src Port: 60712, Dst Port: 80, Seq: 1, Ack: 1, Len: 0

No.     Time           Source                Destination           MAC src    Protocol Length MAC dst    Info
     60 0.036070019    10.10.0.1             12.12.0.12            2a:89:5b:62:44:f2 HTTP     463    b6:0c:f9:58:64:27 GET /index.html HTTP/1.1 

Frame 60: 463 bytes on wire (3704 bits), 463 bytes captured (3704 bits) on interface eth0, id 0
Ethernet II, Src: 2a:89:5b:62:44:f2 (2a:89:5b:62:44:f2), Dst: b6:0c:f9:58:64:27 (b6:0c:f9:58:64:27)
Internet Protocol Version 4, Src: 10.10.0.1, Dst: 12.12.0.12
Transmission Control Protocol, Src Port: 60712, Dst Port: 80, Seq: 1, Ack: 1, Len: 397
Hypertext Transfer Protocol

No.     Time           Source                Destination           MAC src    Protocol Length MAC dst    Info
     61 0.036162191    12.12.0.12            10.10.0.1             b6:0c:f9:58:64:27 TCP      66     2a:89:5b:62:44:f2 80 → 60712 [ACK] Seq=1 Ack=398 Win=64768 Len=0 TSval=3927818972 TSecr=2356592129

Frame 61: 66 bytes on wire (528 bits), 66 bytes captured (528 bits) on interface eth0, id 0
Ethernet II, Src: b6:0c:f9:58:64:27 (b6:0c:f9:58:64:27), Dst: 2a:89:5b:62:44:f2 (2a:89:5b:62:44:f2)
Internet Protocol Version 4, Src: 12.12.0.12, Dst: 10.10.0.1
Transmission Control Protocol, Src Port: 80, Dst Port: 60712, Seq: 1, Ack: 398, Len: 0

No.     Time           Source                Destination           MAC src    Protocol Length MAC dst    Info
     62 0.036642625    12.12.0.12            10.10.0.1             b6:0c:f9:58:64:27 HTTP     891    2a:89:5b:62:44:f2 HTTP/1.1 200 OK  (text/html)

Frame 62: 891 bytes on wire (7128 bits), 891 bytes captured (7128 bits) on interface eth0, id 0
Ethernet II, Src: b6:0c:f9:58:64:27 (b6:0c:f9:58:64:27), Dst: 2a:89:5b:62:44:f2 (2a:89:5b:62:44:f2)
Internet Protocol Version 4, Src: 12.12.0.12, Dst: 10.10.0.1
Transmission Control Protocol, Src Port: 80, Dst Port: 60712, Seq: 1, Ack: 398, Len: 825
Hypertext Transfer Protocol
Line-based text data: text/html (40 lines)

No.     Time           Source                Destination           MAC src    Protocol Length MAC dst    Info
     63 0.036739125    12.12.0.12            10.10.0.1             b6:0c:f9:58:64:27 TCP      66     2a:89:5b:62:44:f2 80 → 60712 [FIN, ACK] Seq=826 Ack=398 Win=64768 Len=0 TSval=3927818972 TSecr=2356592129

Frame 63: 66 bytes on wire (528 bits), 66 bytes captured (528 bits) on interface eth0, id 0
Ethernet II, Src: b6:0c:f9:58:64:27 (b6:0c:f9:58:64:27), Dst: 2a:89:5b:62:44:f2 (2a:89:5b:62:44:f2)
Internet Protocol Version 4, Src: 12.12.0.12, Dst: 10.10.0.1
Transmission Control Protocol, Src Port: 80, Dst Port: 60712, Seq: 826, Ack: 398, Len: 0

No.     Time           Source                Destination           MAC src    Protocol Length MAC dst    Info
